"时间戳记","Participant ID","The condition was interesting for me. ","I would like to share this condition to my friends. ","The exercise was motivating for me.","The condition made me feel tired in body after playing.","I had a good feeling after playing.","How ofter would you like to experience this condition?","Please talk about the details of how it mobilizes your motivation if any.","Please give any comments to this app in general.","Please explain if and why was/wasn't the training session at the beginning of the study useful for you to learn proper stretching poses."
"2022/09/24 4:24:25 下午 GMT+2","2","4","3","4","1","5","Once a month","this simple finger gesture give me a better experience to control the game.","","finger does not help me to stretch"
"2022/09/24 4:45:49 下午 GMT+2","1","5","4","3","4","5","Multiple times a week","none","i dont like the music",""
"2022/09/24 6:33:14 下午 GMT+2","4","4","4","5","5","4","Once a week","","Camera capture is not sensitive",""
"2022/09/24 8:40:24 下午 GMT+2","3","5","5","5","1","5","Everyday","","",""
"2022/09/24 9:00:31 下午 GMT+2","6","4","4","3","1","4","Everyday","","",""
"2022/09/25 8:07:51 下午 GMT+2","5","3","5","3","1","4","Multiple times a week","","",""
"2022/09/25 8:37:17 下午 GMT+2","7","5","5","5","2","5","Everyday","YES, IT IS A GOOD GAME. I LIKE IT.","MAKE IT NOT SO SENSITIVE.",""
"2022/09/26 12:40:39 上午 GMT+2","8","5","4","3","2","5","Multiple times a week","it is a interesting game for relaxing","it is a little bit too sensitive to recognition",""